{
  "plans": [
    {
      "name": "pay_as_you_go",
      "low": 209892.86,
      "base": 233214.29,
      "high": 256535.71,
      "regret_base_inr": 28142.87,
      "regret_high_inr": 32280.0
    },
    {
      "name": "commit_60m",
      "low": 194880.0,
      "base": 219957.14,
      "high": 247842.86,
      "regret_base_inr": 14885.72,
      "regret_high_inr": 23587.15
    },
    {
      "name": "packages",
      "low": 184441.43,
      "base": 205071.42,
      "high": 224255.71,
      "regret_base_inr": 0.0,
      "regret_high_inr": 0.0
    }
  ],
  "recommended": "packages",
  "robust_choice": "packages",
  "note": "packages is cheapest on base usage (INR 205,071/yr).",
  "flags": [],
  "forecast": {
    "method": "linear_trend",
    "note": "linear_trend won the backtest (MAPE 1.5% on the last 2 months)",
    "band_pct": 10.0,
    "base": [
      59666666.67,
      62952380.95,
      66238095.24,
      69523809.52,
      72809523.81,
      76095238.1,
      79380952.38,
      82666666.67,
      85952380.95,
      89238095.24,
      92523809.52,
      95809523.81
    ],
    "low": [
      53700000.0,
      56657142.86,
      59614285.71,
      62571428.57,
      65528571.43,
      68485714.29,
      71442857.14,
      74400000.0,
      77357142.86,
      80314285.71,
      83271428.57,
      86228571.43
    ],
    "high": [
      65633333.33,
      69247619.05,
      72861904.76,
      76476190.48,
      80090476.19,
      83704761.9,
      87319047.62,
      90933333.33,
      94547619.05,
      98161904.76,
      101776190.48,
      105390476.19
    ]
  }
}
